{
  "schema": "tts-utterance",
  "utterance_id": "tts_evt_d9aa38bdc636459c92ea4e25f665cd0d",
  "event_id": "evt_d9aa38bdc636459c92ea4e25f665cd0d",
  "created_at": "2026-05-20T03:14:00Z",
  "provider": "fake",
  "source_draft_id": "draft_evt_d9aa38bdc636459c92ea4e25f665cd0d_summary",
  "text": "Possible floor-stay event recorded in the Living Room. Please review the local CareSight record.",
  "voice_policy": "neutral_system_voice",
  "validation_status": "validated",
  "safety_boundaries": [
    "draft_only",
    "human_review_required",
    "no_voice_cloning",
    "no_autonomous_dispatch",
    "no_medication_confirmation"
  ]
}
